Annotated Answer,Final_Output,Original_Query,Quality_of_Answer,Query Type,Total_Cost,Total_Energy,Total_Latency,assignment,category,cost,energy,iteration,latency,plan,qoa,query_type,run_time_seconds,source_file,step_logs,struct_id,New_QoA_Score,Feasibility
D,D,"Florsheimand Co. accepted a 90-day sight draft for $425.00 on October 10. It was discounted on November 1 at 5%. If their bank charged a (1/3)% collection fee, what were the proceeds? A) $418.25 B) $416.00 C) $420.00 D) $419.57 E) $421.75 F) $422.50 G) $414.89 H) $423.58 I) $425.00 J) $417.14 Above are multiple-choice questions (with answers) related to business. Respond with the option letter only. Example: F. Do not include any other text or explanation.",1.0,business_mmlu,1.278e-05,12.651281999999998,18.116028,"(3,)",results_business_mmlu,1.0128e-05,9.6926224,1,13.8793696,"[([0], ['qwen2.5:14b'])]",0.79641273021698,business_mmlu,5612.857029676437,qoa_results_business_mmlu_pop200_gen200_add0p3_flip0p1_mut0p3_level4_bound5_cb1p22em05_lb19.47_20.csv,"[{""node"": 0, ""type"": ""leaf"", ""model"": ""qwen2.5:14b"", ""prompt"": ""Question: Florsheimand Co. accepted a 90-day sight draft for $425.00 on October 10. It was discounted on November 1 at 5%. If their bank charged a (1/3)% collection fee, what were the proceeds? A) $418.25 B) $416.00 C) $420.00 D) $419.57 E) $421.75 F) $422.50 G) $414.89 H) $423.58 I) $425.00 J) $417.14 Above are multiple-choice questions (with answers) related to business. Respond with the option letter only. Example: F. Do not include any other text or explanation.\n\nSelect the correct answer.\n\nFormat: \""the answer is X)Option text.\""\nExample: \""the answer is C)Hypertension.\""\n\nOutput (nothing else):"", ""raw_output"": ""the answer is D) $419.57."", ""output"": ""the answer is D) $419."", ""input_tokens"": 181, ""output_tokens"": 8}]",0,1.0,Infeasible (Cost)
H,H,"What are the three differing types of stakeholder theory according to Donaldson and Preston (1995)? A) Normative, Political and Economic B) Political, Descriptive and Economic C) Normative, Moral and Instrumental D) Normative, Descriptive and Political E) Normative, Moral and Economic F) Normative, Instrumental and Economic G) Moral, Descriptive and Instrumental H) Normative, Descriptive and Instrumental I) Political, Descriptive and Instrumental J) Normative, Descriptive and Economic Above are multiple-choice questions (with answers) related to business. Respond with the option letter only. Example: F. Do not include any other text or explanation.",1.0,business_mmlu,1.3979999999999998e-05,12.785158,18.307732,"(3,)",results_business_mmlu,1.0128e-05,9.6926224,1,13.8793696,"[([0], ['qwen2.5:14b'])]",0.79641273021698,business_mmlu,5612.857029676437,qoa_results_business_mmlu_pop200_gen200_add0p3_flip0p1_mut0p3_level4_bound5_cb1p22em05_lb19.47_20.csv,"[{""node"": 0, ""type"": ""leaf"", ""model"": ""qwen2.5:14b"", ""prompt"": ""Question: What are the three differing types of stakeholder theory according to Donaldson and Preston (1995)? A) Normative, Political and Economic B) Political, Descriptive and Economic C) Normative, Moral and Instrumental D) Normative, Descriptive and Political E) Normative, Moral and Economic F) Normative, Instrumental and Economic G) Moral, Descriptive and Instrumental H) Normative, Descriptive and Instrumental I) Political, Descriptive and Instrumental J) Normative, Descriptive and Economic Above are multiple-choice questions (with answers) related to business. Respond with the option letter only. Example: F. Do not include any other text or explanation.\n\nSelect the correct answer.\n\nFormat: \""the answer is X)Option text.\""\nExample: \""the answer is C)Hypertension.\""\n\nOutput (nothing else):"", ""raw_output"": ""the answer is H)Normative, Descriptive and Instrumental."", ""output"": ""the answer is H)Normative, Descriptive and Instrumental."", ""input_tokens"": 177, ""output_tokens"": 14}]",0,1.0,Infeasible (Cost)
D,B,"A machinist spent 23(1/2) hours working on a part. If he is paid at the rate of $3.90 per hour , what was the cost of his labor for the part. A) $76.50 B) $89.25 C) $120.75 D) $91.65 E) $98.70 F) $105.30 G) $102.90 H) $85.50 I) $115.40 J) $93.45 Above are multiple-choice questions (with answers) related to business. Respond with the option letter only. Example: F. Do not include any other text or explanation.",0.2743952870368957,business_mmlu,1.23e-05,12.115778,17.349212,"(3,)",results_business_mmlu,1.0128e-05,9.6926224,1,13.8793696,"[([0], ['qwen2.5:14b'])]",0.79641273021698,business_mmlu,5612.857029676437,qoa_results_business_mmlu_pop200_gen200_add0p3_flip0p1_mut0p3_level4_bound5_cb1p22em05_lb19.47_20.csv,"[{""node"": 0, ""type"": ""leaf"", ""model"": ""qwen2.5:14b"", ""prompt"": ""Question: A machinist spent 23(1/2) hours working on a part. If he is paid at the rate of $3.90 per hour , what was the cost of his labor for the part. A) $76.50 B) $89.25 C) $120.75 D) $91.65 E) $98.70 F) $105.30 G) $102.90 H) $85.50 I) $115.40 J) $93.45 Above are multiple-choice questions (with answers) related to business. Respond with the option letter only. Example: F. Do not include any other text or explanation.\n\nSelect the correct answer.\n\nFormat: \""the answer is X)Option text.\""\nExample: \""the answer is C)Hypertension.\""\n\nOutput (nothing else):"", ""raw_output"": ""the answer is B) $89.25."", ""output"": ""the answer is B) $89."", ""input_tokens"": 173, ""output_tokens"": 8}]",0,0.0,Infeasible (Cost)
I,E,"Find the total earnings of an employee who earns $2.40 per hour with time and a half for more than 8 hours per day if he worked 8 hours on Monday, 7 hours on Tuesday, 9 hours on Wednesday, 9 hours on Thursday, and 10 hours on Friday. A) $99.60 B) $115.20 C) $93.60 D) $102.40 E) $111.60 F) $14.40 G) $120.00 H) $123.60 I) $108.00 J) $96.00 Above are multiple-choice questions (with answers) related to business. Respond with the option letter only. Example: F. Do not include any other text or explanation.",0.0864041447639465,business_mmlu,1.338e-05,13.320662,19.074548,"(3,)",results_business_mmlu,1.0128e-05,9.6926224,1,13.8793696,"[([0], ['qwen2.5:14b'])]",0.79641273021698,business_mmlu,5612.857029676437,qoa_results_business_mmlu_pop200_gen200_add0p3_flip0p1_mut0p3_level4_bound5_cb1p22em05_lb19.47_20.csv,"[{""node"": 0, ""type"": ""leaf"", ""model"": ""qwen2.5:14b"", ""prompt"": ""Question: Find the total earnings of an employee who earns $2.40 per hour with time and a half for more than 8 hours per day if he worked 8 hours on Monday, 7 hours on Tuesday, 9 hours on Wednesday, 9 hours on Thursday, and 10 hours on Friday. A) $99.60 B) $115.20 C) $93.60 D) $102.40 E) $111.60 F) $14.40 G) $120.00 H) $123.60 I) $108.00 J) $96.00 Above are multiple-choice questions (with answers) related to business. Respond with the option letter only. Example: F. Do not include any other text or explanation.\n\nSelect the correct answer.\n\nFormat: \""the answer is X)Option text.\""\nExample: \""the answer is C)Hypertension.\""\n\nOutput (nothing else):"", ""raw_output"": ""the answer is E) $111.60."", ""output"": ""the answer is E) $111."", ""input_tokens"": 191, ""output_tokens"": 8}]",0,0.0,Infeasible (Cost)
H,B,"Mr. Williams owns 75 shares of Mid-Atlantic common stock payinga dividend of $.35 per share, and 135 shares of its 5% $50 par-value preferred stock. Howmuchin dividends doeshe receive? A) $380.00 B) $398.25 C) $412.00 D) $375.25 E) $325.50 F) $350.75 G) $400.00 H) $363.75 I) $345.00 J) $387.50 Above are multiple-choice questions (with answers) related to business. Respond with the option letter only. Example: F. Do not include any other text or explanation.",0.3150942325592041,business_mmlu,1.242e-05,12.249654,17.540916,"(3,)",results_business_mmlu,1.0128e-05,9.6926224,1,13.8793696,"[([0], ['qwen2.5:14b'])]",0.79641273021698,business_mmlu,5612.857029676437,qoa_results_business_mmlu_pop200_gen200_add0p3_flip0p1_mut0p3_level4_bound5_cb1p22em05_lb19.47_20.csv,"[{""node"": 0, ""type"": ""leaf"", ""model"": ""qwen2.5:14b"", ""prompt"": ""Question: Mr. Williams owns 75 shares of Mid-Atlantic common stock payinga dividend of $.35 per share, and 135 shares of its 5% $50 par-value preferred stock. Howmuchin dividends doeshe receive? A) $380.00 B) $398.25 C) $412.00 D) $375.25 E) $325.50 F) $350.75 G) $400.00 H) $363.75 I) $345.00 J) $387.50 Above are multiple-choice questions (with answers) related to business. Respond with the option letter only. Example: F. Do not include any other text or explanation.\n\nSelect the correct answer.\n\nFormat: \""the answer is X)Option text.\""\nExample: \""the answer is C)Hypertension.\""\n\nOutput (nothing else):"", ""raw_output"": ""the answer is B) $398.25."", ""output"": ""the answer is B) $398."", ""input_tokens"": 175, ""output_tokens"": 8}]",0,0.0,Infeasible (Cost)
I,I,"According to Mill, the value of a particular pleasure depends on A) its rarity or frequency. B) societal norms and values. C) the individual's personal preference. D) the amount of effort required to obtain it. E) the potential pain that might accompany it. F) its quantity alone. G) its quality alone. H) neither its quantity nor its quality. I) both its quantity and its quality. J) the duration of the pleasure. Above are multiple-choice questions (with answers) related to philosophy. Respond with the option letter only. Example: F. Do not include any other text or explanation.",1.0,philosophy_mmlu,1.2599999999999998e-05,11.647212,16.678248,"(3,)",results_philosophy_mmlu,1.1424e-05,10.1344132,1,14.511992800000002,"[([0], ['qwen2.5:14b'])]",0.8662476718425751,philosophy_mmlu,7256.34126996994,qoa_results_philosophy_mmlu_pop200_gen200_add0p3_flip0p1_mut0p3_level4_bound5_cb1p22em05_lb200_20.csv,"[{""node"": 0, ""type"": ""leaf"", ""model"": ""qwen2.5:14b"", ""prompt"": ""Question: According to Mill, the value of a particular pleasure depends on A) its rarity or frequency. B) societal norms and values. C) the individual's personal preference. D) the amount of effort required to obtain it. E) the potential pain that might accompany it. F) its quantity alone. G) its quality alone. H) neither its quantity nor its quality. I) both its quantity and its quality. J) the duration of the pleasure. Above are multiple-choice questions (with answers) related to philosophy. Respond with the option letter only. Example: F. Do not include any other text or explanation.\n\nSelect the correct answer.\n\nFormat: \""the answer is X)Option text.\""\nExample: \""the answer is C)Hypertension.\""\n\nOutput (nothing else):"", ""raw_output"": ""the answer is I)both its quantity and its quality."", ""output"": ""the answer is I)both its quantity and its quality."", ""input_tokens"": 162, ""output_tokens"": 12}]",0,1.0,Infeasible (Cost)
F,G,"Which of the following propositions is an immediate (one-step) consequence in PL of the given premises?
(N ⊃ ~O) ⊃ (O ∨ Q)
P ⊃ (N ⊃ ~O)
N ⊃ P A) P ⊃ O B) O ∨ Q C) N ⊃ Q D) O ∨ P E) ~N F) P G) N ⊃ ~O H) P ⊃ Q I) ~O ∨ Q J) ~P Above are multiple-choice questions (with answers) related to philosophy. Respond with the option letter only. Example: F. Do not include any other text or explanation.",0.2670866250991821,philosophy_mmlu,1.296e-05,12.249654,17.540916000000003,"(3,)",results_philosophy_mmlu,1.1424e-05,10.1344132,1,14.511992800000002,"[([0], ['qwen2.5:14b'])]",0.8662476718425751,philosophy_mmlu,7256.34126996994,qoa_results_philosophy_mmlu_pop200_gen200_add0p3_flip0p1_mut0p3_level4_bound5_cb1p22em05_lb200_20.csv,"[{""node"": 0, ""type"": ""leaf"", ""model"": ""qwen2.5:14b"", ""prompt"": ""Question: Which of the following propositions is an immediate (one-step) consequence in PL of the given premises?\n(N \u2283 ~O) \u2283 (O \u2228 Q)\nP \u2283 (N \u2283 ~O)\nN \u2283 P A) P \u2283 O B) O \u2228 Q C) N \u2283 Q D) O \u2228 P E) ~N F) P G) N \u2283 ~O H) P \u2283 Q I) ~O \u2228 Q J) ~P Above are multiple-choice questions (with answers) related to philosophy. Respond with the option letter only. Example: F. Do not include any other text or explanation.\n\nSelect the correct answer.\n\nFormat: \""the answer is X)Option text.\""\nExample: \""the answer is C)Hypertension.\""\n\nOutput (nothing else):"", ""raw_output"": ""the answer is G)N \u2283 ~O."", ""output"": ""the answer is G)N \u2283 ~O."", ""input_tokens"": 172, ""output_tokens"": 11}]",0,0.0,Infeasible (Cost)
F,F,"The Dean was showing a visitor around the campus. The visitor asked, ""About how many students do you have here?"" After a moment of reflection the Dean replied, ""Oh, I'd guess about one in a hundred."" A) Appeal to Authority B) Red Herring C) Denying the Antecedent D) False Dilemma E) Slippery Slope F) Equivocation G) Straw Man H) Fallacy of Division I) Circular Reasoning J) Ad Hominem Above are multiple-choice questions (with answers) related to philosophy. Respond with the option letter only. Example: F. Do not include any other text or explanation.",1.0,philosophy_mmlu,1.236e-05,11.981902,17.157508,"(3,)",results_philosophy_mmlu,1.1424e-05,10.1344132,1,14.511992800000002,"[([0], ['qwen2.5:14b'])]",0.8662476718425751,philosophy_mmlu,7256.34126996994,qoa_results_philosophy_mmlu_pop200_gen200_add0p3_flip0p1_mut0p3_level4_bound5_cb1p22em05_lb200_20.csv,"[{""node"": 0, ""type"": ""leaf"", ""model"": ""qwen2.5:14b"", ""prompt"": ""Question: The Dean was showing a visitor around the campus. The visitor asked, \""About how many students do you have here?\"" After a moment of reflection the Dean replied, \""Oh, I'd guess about one in a hundred.\"" A) Appeal to Authority B) Red Herring C) Denying the Antecedent D) False Dilemma E) Slippery Slope F) Equivocation G) Straw Man H) Fallacy of Division I) Circular Reasoning J) Ad Hominem Above are multiple-choice questions (with answers) related to philosophy. Respond with the option letter only. Example: F. Do not include any other text or explanation.\n\nSelect the correct answer.\n\nFormat: \""the answer is X)Option text.\""\nExample: \""the answer is C)Hypertension.\""\n\nOutput (nothing else):"", ""raw_output"": ""the answer is F)Equivocation."", ""output"": ""the answer is F)Equivocation."", ""input_tokens"": 170, ""output_tokens"": 9}]",0,1.0,Infeasible (Cost)
E,E,"Alice, age 14, is certain that everyone is looking at her because she has a large blemish in the middle of her forehead. According to Elkind (1967), Alice's belief is a manifestation of: A) the “personal fable.” B) ""theory of mind."" C) the “egocentrism.” D) self-concept. E) the “imaginary audience.” F) moral development. G) the “looking-glass self.” H) social referencing. I) self-conscious emotions. J) social comparison. Above are multiple-choice questions (with answers) related to psychology. Respond with the option letter only. Example: F. Do not include any other text or explanation.",1.0,psychology_mmlu,1.356e-05,12.919034,18.499436000000003,"(3,)",results_psychology_mmlu,1.1934e-05,11.0648514,1,15.8443356,"[([0], ['qwen2.5:14b'])]",0.9034036934375764,psychology_mmlu,8909.346123933792,qoa_results_psychology_mmlu_pop200_gen200_add0p3_flip0p1_mut0p3_level4_bound5_cb1p22em05_lb200_20.csv,"[{""node"": 0, ""type"": ""leaf"", ""model"": ""qwen2.5:14b"", ""prompt"": ""Question: Alice, age 14, is certain that everyone is looking at her because she has a large blemish in the middle of her forehead. According to Elkind (1967), Alice's belief is a manifestation of: A) the \u201cpersonal fable.\u201d B) \""theory of mind.\"" C) the \u201cegocentrism.\u201d D) self-concept. E) the \u201cimaginary audience.\u201d F) moral development. G) the \u201clooking-glass self.\u201d H) social referencing. I) self-conscious emotions. J) social comparison. Above are multiple-choice questions (with answers) related to psychology. Respond with the option letter only. Example: F. Do not include any other text or explanation.\n\nSelect the correct answer.\n\nFormat: \""the answer is X)Option text.\""\nExample: \""the answer is C)Hypertension.\""\n\nOutput (nothing else):"", ""raw_output"": ""the answer is E) the \u201cimaginary audience.\u201d"", ""output"": ""the answer is E) the \u201cimaginary audience."", ""input_tokens"": 182, ""output_tokens"": 11}]",0,1.0,Infeasible (Cost)
H,H,What is the Draw-a-Person Test (DAP) ? A) A skill assessment for fine motor coordination through drawing B) A method for drawing expertise C) A personality test that assesses individuals based on their favorite artists D) A technique to improve drawing skills E) A test for artistic ability F) A memory recall test using person imagery G) A cognitive development test for children based on their ability to draw geometric shapes H) An expressive projective technique for diagnostic and therapeutic purposes I) A standardized intelligence test based on drawing precision J) An occupational therapy tool for improving hand-eye coordination Above are multiple-choice questions (with answers) related to psychology. Respond with the option letter only. Example: F. Do not include any other text or explanation.,1.0,psychology_mmlu,1.5059999999999998e-05,13.588414,19.457956000000003,"(3,)",results_psychology_mmlu,1.1934e-05,11.0648514,1,15.8443356,"[([0], ['qwen2.5:14b'])]",0.9034036934375764,psychology_mmlu,8909.346123933792,qoa_results_psychology_mmlu_pop200_gen200_add0p3_flip0p1_mut0p3_level4_bound5_cb1p22em05_lb200_20.csv,"[{""node"": 0, ""type"": ""leaf"", ""model"": ""qwen2.5:14b"", ""prompt"": ""Question: What is the Draw-a-Person Test (DAP) ? A) A skill assessment for fine motor coordination through drawing B) A method for drawing expertise C) A personality test that assesses individuals based on their favorite artists D) A technique to improve drawing skills E) A test for artistic ability F) A memory recall test using person imagery G) A cognitive development test for children based on their ability to draw geometric shapes H) An expressive projective technique for diagnostic and therapeutic purposes I) A standardized intelligence test based on drawing precision J) An occupational therapy tool for improving hand-eye coordination Above are multiple-choice questions (with answers) related to psychology. Respond with the option letter only. Example: F. Do not include any other text or explanation.\n\nSelect the correct answer.\n\nFormat: \""the answer is X)Option text.\""\nExample: \""the answer is C)Hypertension.\""\n\nOutput (nothing else):"", ""raw_output"": ""the answer is H) An expressive projective technique for diagnostic and therapeutic purposes."", ""output"": ""the answer is H) An expressive projective technique for diagnostic and therapeutic purposes."", ""input_tokens"": 187, ""output_tokens"": 16}]",0,1.0,Infeasible (Cost)
J,J,"Why are the stem reptiles especially important in evolution? A) They exclusively evolved into modern reptiles without any other descendants B) They were the first reptiles to return to an aquatic lifestyle C) They gave rise to only the dinosaurs D) They were the only reptiles to develop flight E) They existed only in the Mesozoic Era F) They were the last reptiles to evolve G) They represent the peak of reptilian evolution in terms of size and complexity H) They were exclusively herbivorous, unlike other reptiles I) They were the first reptiles to develop endothermy (warm-bloodedness) J) They were the ancestral form of a variety of important animals, including the mammals. Above are multiple-choice questions (with answers) related to biology. Respond with the option letter only. Example: F. Do not include any other text or explanation.",1.0,biology_mmlu,7.125999999999999e-06,24.425665,37.596005,"(0,)",results_biology_mmlu,8.335799999999999e-06,27.9803788,1,43.0674236,"[([0], ['mistral:7b'])]",0.8395025610923768,biology_mmlu,5469.501084327698,qoa_results_biology_mmlu_pop200_gen200_add0p3_flip0p1_mut0p3_level4_bound5_cb1p22em05_lb200_20.csv,"[{""node"": 0, ""type"": ""leaf"", ""model"": ""mistral:7b"", ""prompt"": ""Question: Why are the stem reptiles especially important in evolution? A) They exclusively evolved into modern reptiles without any other descendants B) They were the first reptiles to return to an aquatic lifestyle C) They gave rise to only the dinosaurs D) They were the only reptiles to develop flight E) They existed only in the Mesozoic Era F) They were the last reptiles to evolve G) They represent the peak of reptilian evolution in terms of size and complexity H) They were exclusively herbivorous, unlike other reptiles I) They were the first reptiles to develop endothermy (warm-bloodedness) J) They were the ancestral form of a variety of important animals, including the mammals. Above are multiple-choice questions (with answers) related to biology. Respond with the option letter only. Example: F. Do not include any other text or explanation.\n\nSelect the correct answer.\n\nFormat: \""the answer is X)Option text.\""\nExample: \""the answer is C)Hypertension.\""\n\nOutput (nothing else):"", ""raw_output"": ""the answer is J)They were the ancestral form of a variety of important animals, including the mammals."", ""output"": ""the answer is J)They were the ancestral form of a variety of important animals, including the mammals."", ""input_tokens"": 214, ""output_tokens"": 21}]",0,1.0,Infeasible (Latency)
E,E,"In very basic terms describe the structure of a retroviral virion. A) The virion is composed of the DNA genome, a surrounding protein capsid, and an inner lipid bilayer envelope. B) The virion is composed of the RNA genome, a surrounding carbohydrate capsid, and an outer protein bilayer envelope. C) The virion is composed solely of an RNA genome. D) The virion is composed of the RNA genome and an outer carbohydrate bilayer envelope, without a capsid. E) The virion is composed of the RNA genome, a surrounding protein capsid, and an outer lipid bilayer envelope. F) The virion is composed of the DNA genome, a surrounding carbohydrate capsid, and an outer lipid bilayer envelope. G) The virion is composed of the DNA genome, a surrounding lipid bilayer capsid, and an outer carbohydrate envelope. H) The virion is composed of the RNA genome, a surrounding carbohydrate capsid, and an inner protein bilayer envelope. I) The virion is composed of the RNA genome, a surrounding lipid bilayer capsid, and an inner protein envelope. J) The virion is composed of a protein genome, a surrounding carbohydrate capsid, and an outer lipid bilayer envelope. Above are multiple-choice questions (with answers) related to biology. Respond with the option letter only. Example: F. Do not include any other text or explanation.",1.0,biology_mmlu,1.0778e-05,37.210162,57.273914,"(0,)",results_biology_mmlu,8.335799999999999e-06,27.9803788,1,43.0674236,"[([0], ['mistral:7b'])]",0.8395025610923768,biology_mmlu,5469.501084327698,qoa_results_biology_mmlu_pop200_gen200_add0p3_flip0p1_mut0p3_level4_bound5_cb1p22em05_lb200_20.csv,"[{""node"": 0, ""type"": ""leaf"", ""model"": ""mistral:7b"", ""prompt"": ""Question: In very basic terms describe the structure of a retroviral virion. A) The virion is composed of the DNA genome, a surrounding protein capsid, and an inner lipid bilayer envelope. B) The virion is composed of the RNA genome, a surrounding carbohydrate capsid, and an outer protein bilayer envelope. C) The virion is composed solely of an RNA genome. D) The virion is composed of the RNA genome and an outer carbohydrate bilayer envelope, without a capsid. E) The virion is composed of the RNA genome, a surrounding protein capsid, and an outer lipid bilayer envelope. F) The virion is composed of the DNA genome, a surrounding carbohydrate capsid, and an outer lipid bilayer envelope. G) The virion is composed of the DNA genome, a surrounding lipid bilayer capsid, and an outer carbohydrate envelope. H) The virion is composed of the RNA genome, a surrounding carbohydrate capsid, and an inner protein bilayer envelope. I) The virion is composed of the RNA genome, a surrounding lipid bilayer capsid, and an inner protein envelope. J) The virion is composed of a protein genome, a surrounding carbohydrate capsid, and an outer lipid bilayer envelope. Above are multiple-choice questions (with answers) related to biology. Respond with the option letter only. Example: F. Do not include any other text or explanation.\n\nSelect the correct answer.\n\nFormat: \""the answer is X)Option text.\""\nExample: \""the answer is C)Hypertension.\""\n\nOutput (nothing else):"", ""raw_output"": ""E) The answer is E) the virion is composed of the RNA genome, a surrounding protein capsid, and an outer lipid bilayer envelope."", ""output"": ""the answer is E) the virion is composed of the RNA genome, a surrounding protein capsid, and an outer lipid bilayer envelope."", ""input_tokens"": 329, ""output_tokens"": 29}]",0,1.0,Infeasible (Latency)
