Annotated Answer,Final_Output,Original_Query,Quality_of_Answer,Query Type,Total_Cost,Total_Energy,Total_Latency,assignment,category,cost,energy,iteration,latency,plan,qoa,query_type,run_time_seconds,source_file,step_logs,struct_id,New_QoA_Score,Feasibility
1774,The given answer is correct.,"In which year was the municipality of Santa B√°rbara, Antioquia, Colombia, founded?",0.2846428155899048,Geography,4.874e-06,15.486911,23.837467,"(0, 0)",results_geography,8.774666666666667e-06,30.83523666666667,1,47.46162333333333,"[([0, 1], ['mistral:7b', 'mistral:7b'])]",0.4909502118825912,Geography,14552.033256530762,qoa_results_geography_pop200_gen200_add0p3_flip0p1_mut0p3_level4_bound5_cb1p22em05_lb200_20.csv,"[{""node"": 0, ""type"": ""leaf"", ""model"": ""mistral:7b"", ""prompt"": ""Question: In which year was the municipality of Santa B\u221a\u00b0rbara, Antioquia, Colombia, founded?\n\nProvide the accurate answer directly.\n\nOutput (nothing else):"", ""raw_output"": ""The municipality of Santa B\u00e1rbara, Antioquia, Colombia, was founded in 1856."", ""output"": ""The municipality of Santa B\u00e1rbara, Antioquia, Colombia, was founded in 1856."", ""input_tokens"": 36, ""output_tokens"": 21}, {""node"": 1, ""type"": ""verification"", ""model"": ""mistral:7b"", ""prompt"": ""Question: In which year was the municipality of Santa B\u221a\u00b0rbara, Antioquia, Colombia, founded?\n\nAnswer to verify: The municipality of Santa B\u00e1rbara, Antioquia, Colombia, was founded in 1856.\n\nTask: Verify accuracy.\n\nRules:\n- If correct, output it exactly as given\n- If wrong, provide correct answer\n- Be concise and direct\n\nOutput (nothing else):"", ""parent_output"": ""The municipality of Santa B\u00e1rbara, Antioquia, Colombia, was founded in 1856."", ""raw_output"": ""The given answer is correct."", ""output"": ""The given answer is correct."", ""input_tokens"": 86, ""output_tokens"": 6}]",1,0.2846428155899048,Infeasible (Latency)
friar Juan de Los Barrios,"Juan de Corral is indeed credited as the founder of Cucaita, Boyacá, Colombia in 1539.","Who founded the municipality of Cucaita, Boyac√°, Colombia?",0.4276701807975769,Geography,5.974e-06,17.253874000000003,26.557178,"(0, 0)",results_geography,8.774666666666667e-06,30.83523666666667,1,47.46162333333333,"[([0, 1], ['mistral:7b', 'mistral:7b'])]",0.4909502118825912,Geography,14552.033256530762,qoa_results_geography_pop200_gen200_add0p3_flip0p1_mut0p3_level4_bound5_cb1p22em05_lb200_20.csv,"[{""node"": 0, ""type"": ""leaf"", ""model"": ""mistral:7b"", ""prompt"": ""Question: Who founded the municipality of Cucaita, Boyac\u221a\u00b0, Colombia?\n\nProvide the accurate answer directly.\n\nOutput (nothing else):"", ""raw_output"": ""Juan de Corral is credited as the founder of Cucaita, Boyac\u221a\u2020, Colombia in 1539."", ""output"": ""Juan de Corral is credited as the founder of Cucaita, Boyac\u221a\u2020, Colombia in 1539."", ""input_tokens"": 30, ""output_tokens"": 26}, {""node"": 1, ""type"": ""verification"", ""model"": ""mistral:7b"", ""prompt"": ""Question: Who founded the municipality of Cucaita, Boyac\u221a\u00b0, Colombia?\n\nAnswer to verify: Juan de Corral is credited as the founder of Cucaita, Boyac\u221a\u2020, Colombia in 1539.\n\nTask: Verify accuracy.\n\nRules:\n- If correct, output it exactly as given\n- If wrong, provide correct answer\n- Be concise and direct\n\nOutput (nothing else):"", ""parent_output"": ""Juan de Corral is credited as the founder of Cucaita, Boyac\u221a\u2020, Colombia in 1539."", ""raw_output"": ""Juan de Corral is indeed credited as the founder of Cucaita, Boyac\u00e1, Colombia in 1539."", ""output"": ""Juan de Corral is indeed credited as the founder of Cucaita, Boyac\u00e1, Colombia in 1539."", ""input_tokens"": 85, ""output_tokens"": 25}]",1,0.42767006158828735,Infeasible (Latency)
friar Juan de Los Barrios,"The municipality of Cucaita, Boyac√°, Colombia was not founded by Jorge Eliecer Gaitan.","Who founded the municipality of Cucaita, Boyac√°, Colombia?",0.3279052674770355,Geography,5.37e-06,13.676087,20.578419,"(1, 0)",results_geography,1.1672333333333332e-05,30.131003000000003,1,44.83388433333334,"[([0, 1], ['llama3-chatqa:8b', 'mistral:7b'])]",0.3783546984195709,Geography,14552.033256530762,qoa_results_geography_pop200_gen200_add0p3_flip0p1_mut0p3_level4_bound5_cb1p22em05_lb200_20.csv,"[{""node"": 0, ""type"": ""leaf"", ""model"": ""llama3-chatqa:8b"", ""prompt"": ""Question: Who founded the municipality of Cucaita, Boyac\u221a\u00b0, Colombia?\n\nProvide the accurate answer directly.\n\nOutput (nothing else):"", ""raw_output"": ""Jorge Eliecer Gaitan"", ""output"": ""Jorge Eliecer Gaitan"", ""input_tokens"": 30, ""output_tokens"": 8}, {""node"": 1, ""type"": ""verification"", ""model"": ""mistral:7b"", ""prompt"": ""Question: Who founded the municipality of Cucaita, Boyac\u221a\u00b0, Colombia?\n\nAnswer to verify: Jorge Eliecer Gaitan\n\nTask: Verify accuracy.\n\nRules:\n- If correct, output it exactly as given\n- If wrong, provide correct answer\n- Be concise and direct\n\nOutput (nothing else):"", ""parent_output"": ""Jorge Eliecer Gaitan"", ""raw_output"": ""The municipality of Cucaita, Boyac\u221a\u00b0, Colombia was not founded by Jorge Eliecer Gaitan. It is unknown who specifically founded the town."", ""output"": ""The municipality of Cucaita, Boyac\u221a\u00b0, Colombia was not founded by Jorge Eliecer Gaitan."", ""input_tokens"": 67, ""output_tokens"": 26}]",1,0.3279052674770355,Infeasible (Latency)
B,G,"A 52-year-old man is admitted to the hospital because of severe dyspnea and cough productive of tenacious, brownishyellow sputum for the past 3 weeks. He has a 15-year career history of sandblasting old buildings. He has smoked two packs of cigarettes daily for the past 30 years. The patient is 168 cm (5 ft 6 in) tall and weighs 59 kg (130 lb); BMI is 21 kg/m2 . Vital signs are temperature 36.8°C (98.2°F), pulse 94/min, and blood pressure 150/92 mm Hg. Pulse oximetry on room air shows an oxygen saturation of 70%. On physical examination he is in moderately severe distress with pursed lips and cyanotic nail beds. Chest has an increased anteroposterior diameter. Auscultation of the chest discloses scattered wheezes and rhonchi over all lung fields. Cardiac examination discloses muffled heart sounds and an S4. Fingers are clubbed. Chest x-ray shows hyperinflated lungs, flattened diaphragm, large, irregular opacities in the upper lobes, and eggshell calcifications of the hilar lymph nodes. In addition to antibiotic therapy, which of the following is the most appropriate intervention? A) Lung transplantation B) Continuous humidified oxygen C) Daily chest physiotherapy D) Pulmonary rehabilitation E) Azathioprine therapy F) Bronchoscopy G) Corticosteroid therapy H) Nocturnal continuous positive airway pressure (CPAP) Above are multiple-choice questions (with answers) related to health. Respond with the option letter only. Example: F. Do not include any other text or explanation.",0.1107773184776306,health_mmlu,1.1544e-05,41.887417,64.47314899999999,"(0,)",results_health_mmlu,7.2276e-06,25.1116624,1,38.6518928,"[([0], ['mistral:7b'])]",0.6433739781379699,health_mmlu,7951.484551906586,qoa_results_health_mmlu_pop200_gen200_add0p3_flip0p1_mut0p3_level4_bound5_cb1p22em05_lb200_20.csv,"[{""node"": 0, ""type"": ""leaf"", ""model"": ""mistral:7b"", ""prompt"": ""Question: A 52-year-old man is admitted to the hospital because of severe dyspnea and cough productive of tenacious, brownishyellow sputum for the past 3 weeks. He has a 15-year career history of sandblasting old buildings. He has smoked two packs of cigarettes daily for the past 30 years. The patient is 168 cm (5 ft 6 in) tall and weighs 59 kg (130 lb); BMI is 21 kg/m2 . Vital signs are temperature 36.8\u00b0C (98.2\u00b0F), pulse 94/min, and blood pressure 150/92 mm Hg. Pulse oximetry on room air shows an oxygen saturation of 70%. On physical examination he is in moderately severe distress with pursed lips and cyanotic nail beds. Chest has an increased anteroposterior diameter. Auscultation of the chest discloses scattered wheezes and rhonchi over all lung fields. Cardiac examination discloses muffled heart sounds and an S4. Fingers are clubbed. Chest x-ray shows hyperinflated lungs, flattened diaphragm, large, irregular opacities in the upper lobes, and eggshell calcifications of the hilar lymph nodes. In addition to antibiotic therapy, which of the following is the most appropriate intervention? A) Lung transplantation B) Continuous humidified oxygen C) Daily chest physiotherapy D) Pulmonary rehabilitation E) Azathioprine therapy F) Bronchoscopy G) Corticosteroid therapy H) Nocturnal continuous positive airway pressure (CPAP) Above are multiple-choice questions (with answers) related to health. Respond with the option letter only. Example: F. Do not include any other text or explanation.\n\nSelect the correct answer.\n\nFormat: \""the answer is X)Option text.\""\nExample: \""the answer is C)Hypertension.\""\n\nOutput (nothing else):"", ""raw_output"": ""the answer is G) Corticosteroid therapy"", ""output"": ""the answer is G) Corticosteroid therapy"", ""input_tokens"": 393, ""output_tokens"": 10}]",0,0.0,Infeasible (Latency)
H,H,An allele that is masked is referred to as: A) reclusive. B) residual. C) resistant. D) reductive. E) reactive. F) reflective. G) redundant. H) recessive. I) refractive. J) repressed. Above are multiple-choice questions (with answers) related to health. Respond with the option letter only. Example: F. Do not include any other text or explanation.,1.0,health_mmlu,3.904e-06,13.719948,21.117756,"(0,)",results_health_mmlu,7.2276e-06,25.1116624,1,38.6518928,"[([0], ['mistral:7b'])]",0.6433739781379699,health_mmlu,7951.484551906586,qoa_results_health_mmlu_pop200_gen200_add0p3_flip0p1_mut0p3_level4_bound5_cb1p22em05_lb200_20.csv,"[{""node"": 0, ""type"": ""leaf"", ""model"": ""mistral:7b"", ""prompt"": ""Question: An allele that is masked is referred to as: A) reclusive. B) residual. C) resistant. D) reductive. E) reactive. F) reflective. G) redundant. H) recessive. I) refractive. J) repressed. Above are multiple-choice questions (with answers) related to health. Respond with the option letter only. Example: F. Do not include any other text or explanation.\n\nSelect the correct answer.\n\nFormat: \""the answer is X)Option text.\""\nExample: \""the answer is C)Hypertension.\""\n\nOutput (nothing else):"", ""raw_output"": ""the answer is H) recessive."", ""output"": ""the answer is H) recessive."", ""input_tokens"": 124, ""output_tokens"": 8}]",0,1.0,Infeasible (Latency)
B,H,"A 19-year-old Asian female college student comes to the university health center because of a 1-week history of nasal stuffiness, occasional clear rhinorrhea, and a mild sore throat. Two days ago, she began to feel hot, but she has not taken her temperature. Medical history is unremarkable and her only medication is an oral contraceptive. She has no history of allergies. She does not smoke cigarettes. BMI is 22 kg/m2 . Vital signs are temperature 38.1°C (100.6°F), pulse 88/min, respirations 16/min, and blood pressure 116/74 mm Hg. Physical examination discloses tenderness over the left maxillary sinus without purulent drainage. There is clear fluid behind the left tympanic membrane, enlarged tonsils bilaterally, and pain with tapping of the left upper incisors. Left frontal sinus does not transilluminate. Cardiopulmonary examination discloses no abnormalities. Which of the following is the most likely underlying mechanism of this patient's sinusitis? A) Allergic reaction B) Mucosal edema C) Bacterial infection D) Eustachian tube dysfunction E) Immune system disorder F) Fungal infection G) Chronic sinusitis H) Viral infection I) Nasal polyps J) Oral contraceptive use Above are multiple-choice questions (with answers) related to health. Respond with the option letter only. Example: F. Do not include any other text or explanation.",0.3360015451908111,health_mmlu,9.952e-06,36.170772,55.67408399999999,"(0,)",results_health_mmlu,7.2276e-06,25.1116624,1,38.6518928,"[([0], ['mistral:7b'])]",0.6433739781379699,health_mmlu,7951.484551906586,qoa_results_health_mmlu_pop200_gen200_add0p3_flip0p1_mut0p3_level4_bound5_cb1p22em05_lb200_20.csv,"[{""node"": 0, ""type"": ""leaf"", ""model"": ""mistral:7b"", ""prompt"": ""Question: A 19-year-old Asian female college student comes to the university health center because of a 1-week history of nasal stuffiness, occasional clear rhinorrhea, and a mild sore throat. Two days ago, she began to feel hot, but she has not taken her temperature. Medical history is unremarkable and her only medication is an oral contraceptive. She has no history of allergies. She does not smoke cigarettes. BMI is 22 kg/m2 . Vital signs are temperature 38.1\u00b0C (100.6\u00b0F), pulse 88/min, respirations 16/min, and blood pressure 116/74 mm Hg. Physical examination discloses tenderness over the left maxillary sinus without purulent drainage. There is clear fluid behind the left tympanic membrane, enlarged tonsils bilaterally, and pain with tapping of the left upper incisors. Left frontal sinus does not transilluminate. Cardiopulmonary examination discloses no abnormalities. Which of the following is the most likely underlying mechanism of this patient's sinusitis? A) Allergic reaction B) Mucosal edema C) Bacterial infection D) Eustachian tube dysfunction E) Immune system disorder F) Fungal infection G) Chronic sinusitis H) Viral infection I) Nasal polyps J) Oral contraceptive use Above are multiple-choice questions (with answers) related to health. Respond with the option letter only. Example: F. Do not include any other text or explanation.\n\nSelect the correct answer.\n\nFormat: \""the answer is X)Option text.\""\nExample: \""the answer is C)Hypertension.\""\n\nOutput (nothing else):"", ""raw_output"": ""the answer is H) Viral infection"", ""output"": ""the answer is H) Viral infection"", ""input_tokens"": 340, ""output_tokens"": 8}]",0,0.0,Infeasible (Latency)
F,E,Genetic characteristics of the bunyavirus family include which one of the following? A) Emerging viruses via arthropod vector B) Single-stranded DNA viruses C) Viruses that primarily infect plants D) Viruses using a DNA-dependent RNA polymerase E) Viruses with a positive-sense RNA F) Three segmented negative stranded RNA viruses with anti-sense expression G) Viruses that only infect bacteria H) Highly mutable RNA viruses I) Use an RT enzyme J) Double-stranded RNA viruses Above are multiple-choice questions (with answers) related to health. Respond with the option letter only. Example: F. Do not include any other text or explanation.,0.2008751034736633,health_mmlu,5.272e-06,18.605081,28.636957,"(0,)",results_health_mmlu,7.2276e-06,25.1116624,1,38.6518928,"[([0], ['mistral:7b'])]",0.6433739781379699,health_mmlu,7951.484551906586,qoa_results_health_mmlu_pop200_gen200_add0p3_flip0p1_mut0p3_level4_bound5_cb1p22em05_lb200_20.csv,"[{""node"": 0, ""type"": ""leaf"", ""model"": ""mistral:7b"", ""prompt"": ""Question: Genetic characteristics of the bunyavirus family include which one of the following? A) Emerging viruses via arthropod vector B) Single-stranded DNA viruses C) Viruses that primarily infect plants D) Viruses using a DNA-dependent RNA polymerase E) Viruses with a positive-sense RNA F) Three segmented negative stranded RNA viruses with anti-sense expression G) Viruses that only infect bacteria H) Highly mutable RNA viruses I) Use an RT enzyme J) Double-stranded RNA viruses Above are multiple-choice questions (with answers) related to health. Respond with the option letter only. Example: F. Do not include any other text or explanation.\n\nSelect the correct answer.\n\nFormat: \""the answer is X)Option text.\""\nExample: \""the answer is C)Hypertension.\""\n\nOutput (nothing else):"", ""raw_output"": ""E) Positive-sense RNA"", ""output"": ""the answer is E) Positive-sense RNA."", ""input_tokens"": 169, ""output_tokens"": 10}]",0,0.0,Infeasible (Latency)
A,I,Do traits change with age? A) They change a little B) They only change due to major life events C) Only after the age of 60 D) Only in childhood E) Only for women F) They change drastically G) No H) Only for men I) They change quite a lot J) They don't change at all Above are multiple-choice questions (with answers) related to health. Respond with the option letter only. Example: F. Do not include any other text or explanation.,0.1998941004276275,health_mmlu,4.404e-06,15.382972000000002,23.677484,"(0,)",results_health_mmlu,7.2276e-06,25.1116624,1,38.6518928,"[([0], ['mistral:7b'])]",0.6433739781379699,health_mmlu,7951.484551906586,qoa_results_health_mmlu_pop200_gen200_add0p3_flip0p1_mut0p3_level4_bound5_cb1p22em05_lb200_20.csv,"[{""node"": 0, ""type"": ""leaf"", ""model"": ""mistral:7b"", ""prompt"": ""Question: Do traits change with age? A) They change a little B) They only change due to major life events C) Only after the age of 60 D) Only in childhood E) Only for women F) They change drastically G) No H) Only for men I) They change quite a lot J) They don't change at all Above are multiple-choice questions (with answers) related to health. Respond with the option letter only. Example: F. Do not include any other text or explanation.\n\nSelect the correct answer.\n\nFormat: \""the answer is X)Option text.\""\nExample: \""the answer is C)Hypertension.\""\n\nOutput (nothing else):"", ""raw_output"": ""the answer is I) They change quite a lot"", ""output"": ""the answer is I) They change quite a lot"", ""input_tokens"": 138, ""output_tokens"": 10}]",0,0.0,Infeasible (Latency)
D,A,"Name three of the five main uses of the hand. A) Sensory, wave, punch. B) Punch, touch, slap. C) Tap, slap, clap. D) Grip, percussion, sensory. E) Pinch, wave, tickle. F) Clap, stroke, grip. G) Touch, feel, stroke. H) Wave, scratch, tickle. I) Stroke, slap, punch. J) Touch, pinch, grasp. Above are multiple-choice questions (with answers) related to health. Respond with the option letter only. Example: F. Do not include any other text or explanation.",0.1879486739635467,health_mmlu,5.214e-06,18.293264,28.157008,"(0,)",results_health_mmlu,7.2276e-06,25.1116624,1,38.6518928,"[([0], ['mistral:7b'])]",0.6433739781379699,health_mmlu,7951.484551906586,qoa_results_health_mmlu_pop200_gen200_add0p3_flip0p1_mut0p3_level4_bound5_cb1p22em05_lb200_20.csv,"[{""node"": 0, ""type"": ""leaf"", ""model"": ""mistral:7b"", ""prompt"": ""Question: Name three of the five main uses of the hand. A) Sensory, wave, punch. B) Punch, touch, slap. C) Tap, slap, clap. D) Grip, percussion, sensory. E) Pinch, wave, tickle. F) Clap, stroke, grip. G) Touch, feel, stroke. H) Wave, scratch, tickle. I) Stroke, slap, punch. J) Touch, pinch, grasp. Above are multiple-choice questions (with answers) related to health. Respond with the option letter only. Example: F. Do not include any other text or explanation.\n\nSelect the correct answer.\n\nFormat: \""the answer is X)Option text.\""\nExample: \""the answer is C)Hypertension.\""\n\nOutput (nothing else):"", ""raw_output"": ""The answers are:\nA) Grip, percussion, sensory.\nB) Punch, touch, slap.\nD) Grip, percussion, sensory."", ""output"": ""the answer is A) Grip, percussion, sensory."", ""input_tokens"": 165, ""output_tokens"": 11}]",0,0.0,Infeasible (Latency)
C,J,"A 40-year-old woman comes to the physician because of a 6-month history of increased facial hair growth. Her last menstrual period was 4 months ago. She is 165 cm (5 ft 5 in) tall and weighs 70 kg (154 lb); BMI is 26 kg/m2 . Her pulse is 80/min, and blood pressure is 130/82 mm Hg. Physical examination shows temporal balding and coarse dark hair on the upper lip and chin. Pelvic examination shows clitoral enlargement. Her serum testosterone concentration is increased. Serum concentrations of androstenedione, dehydroepiandrosterone, and urinary 17-ketosteroids are within the reference ranges. Ultrasonography of the pelvis shows a 12-cm ovarian mass. Which of the following best describes this mass? A) Endometrioid tumor B) Fibroma C) Sertoli-Leydig tumor D) Mucinous cystadenoma E) Clear cell carcinoma F) Brenner tumor G) Ovarian carcinoid H) Teratoma I) Serous cystadenoma J) Granulosa tumor Above are multiple-choice questions (with answers) related to health. Respond with the option letter only. Example: F. Do not include any other text or explanation.",0.332362949848175,health_mmlu,8.996e-06,32.428968,49.91469599999999,"(0,)",results_health_mmlu,7.2276e-06,25.1116624,1,38.6518928,"[([0], ['mistral:7b'])]",0.6433739781379699,health_mmlu,7951.484551906586,qoa_results_health_mmlu_pop200_gen200_add0p3_flip0p1_mut0p3_level4_bound5_cb1p22em05_lb200_20.csv,"[{""node"": 0, ""type"": ""leaf"", ""model"": ""mistral:7b"", ""prompt"": ""Question: A 40-year-old woman comes to the physician because of a 6-month history of increased facial hair growth. Her last menstrual period was 4 months ago. She is 165 cm (5 ft 5 in) tall and weighs 70 kg (154 lb); BMI is 26 kg/m2 . Her pulse is 80/min, and blood pressure is 130/82 mm Hg. Physical examination shows temporal balding and coarse dark hair on the upper lip and chin. Pelvic examination shows clitoral enlargement. Her serum testosterone concentration is increased. Serum concentrations of androstenedione, dehydroepiandrosterone, and urinary 17-ketosteroids are within the reference ranges. Ultrasonography of the pelvis shows a 12-cm ovarian mass. Which of the following best describes this mass? A) Endometrioid tumor B) Fibroma C) Sertoli-Leydig tumor D) Mucinous cystadenoma E) Clear cell carcinoma F) Brenner tumor G) Ovarian carcinoid H) Teratoma I) Serous cystadenoma J) Granulosa tumor Above are multiple-choice questions (with answers) related to health. Respond with the option letter only. Example: F. Do not include any other text or explanation.\n\nSelect the correct answer.\n\nFormat: \""the answer is X)Option text.\""\nExample: \""the answer is C)Hypertension.\""\n\nOutput (nothing else):"", ""raw_output"": ""The answer is J) Granulosa tumor."", ""output"": ""the answer is J) Granulosa tumor."", ""input_tokens"": 302, ""output_tokens"": 10}]",0,0.0,Infeasible (Latency)
G,A,Parasympathetic preganglionic axons leave the CNS with the A) cervical spinal nerves. B) optometric nerves. C) lumbar spinal nerves. D) hypoglossal nerves. E) olfactory nerves. F) trigeminal nerves. G) sacral spinal nerves. H) spinal accessory nerves. I) thoracic spinal nerves. Above are multiple-choice questions (with answers) related to health. Respond with the option letter only. Example: F. Do not include any other text or explanation.,0.1119193285703659,health_mmlu,4.546e-06,16.006606,24.637382,"(0,)",results_health_mmlu,7.2276e-06,25.1116624,1,38.6518928,"[([0], ['mistral:7b'])]",0.6433739781379699,health_mmlu,7951.484551906586,qoa_results_health_mmlu_pop200_gen200_add0p3_flip0p1_mut0p3_level4_bound5_cb1p22em05_lb200_20.csv,"[{""node"": 0, ""type"": ""leaf"", ""model"": ""mistral:7b"", ""prompt"": ""Question: Parasympathetic preganglionic axons leave the CNS with the A) cervical spinal nerves. B) optometric nerves. C) lumbar spinal nerves. D) hypoglossal nerves. E) olfactory nerves. F) trigeminal nerves. G) sacral spinal nerves. H) spinal accessory nerves. I) thoracic spinal nerves. Above are multiple-choice questions (with answers) related to health. Respond with the option letter only. Example: F. Do not include any other text or explanation.\n\nSelect the correct answer.\n\nFormat: \""the answer is X)Option text.\""\nExample: \""the answer is C)Hypertension.\""\n\nOutput (nothing else):"", ""raw_output"": ""A) cervical spinal nerves"", ""output"": ""the answer is A) cervical spinal nerves."", ""input_tokens"": 145, ""output_tokens"": 9}]",0,0.0,Infeasible (Latency)
G,A,Enzyme assay can be used to identify carriers of: A) Turner syndrome. B) Fragile X syndrome. C) Cystic fibrosis. D) Autism. E) Muscular dystrophy. F) Sickle cell anemia. G) Tay-Sachs disease. H) Huntington's disease. I) Down syndrome. Above are multiple-choice questions (with answers) related to health. Respond with the option letter only. Example: F. Do not include any other text or explanation.,0.1651045829057693,health_mmlu,4.566e-06,15.694789000000002,24.157433,"(0,)",results_health_mmlu,7.2276e-06,25.1116624,1,38.6518928,"[([0], ['mistral:7b'])]",0.6433739781379699,health_mmlu,7951.484551906586,qoa_results_health_mmlu_pop200_gen200_add0p3_flip0p1_mut0p3_level4_bound5_cb1p22em05_lb200_20.csv,"[{""node"": 0, ""type"": ""leaf"", ""model"": ""mistral:7b"", ""prompt"": ""Question: Enzyme assay can be used to identify carriers of: A) Turner syndrome. B) Fragile X syndrome. C) Cystic fibrosis. D) Autism. E) Muscular dystrophy. F) Sickle cell anemia. G) Tay-Sachs disease. H) Huntington's disease. I) Down syndrome. Above are multiple-choice questions (with answers) related to health. Respond with the option letter only. Example: F. Do not include any other text or explanation.\n\nSelect the correct answer.\n\nFormat: \""the answer is X)Option text.\""\nExample: \""the answer is C)Hypertension.\""\n\nOutput (nothing else):"", ""raw_output"": ""A) C) Cystic fibrosis.\nG) G) Tay-Sachs disease.\nH) H) Huntington's disease."", ""output"": ""the answer is A) C) Cystic fibrosis."", ""input_tokens"": 138, ""output_tokens"": 13}]",0,0.0,Infeasible (Latency)
