Annotated Answer,Final_Output,Original_Query,Quality_of_Answer,Query Type,Total_Cost,Total_Energy,Total_Latency,assignment,category,cost,energy,iteration,latency,plan,qoa,query_type,run_time_seconds,source_file,step_logs,struct_id,New_QoA_Score,Feasibility
C,B,"According to Hume, justice: A) has no value. B) has value in part because it is useful to society. C) has value solely because it is useful to society. D) has value solely because it is useful to the agent. Above are multiple-choice questions (with answers) related to philosophy. Respond with the option letter only. Example: F. Do not include any other text or explanation.",0.2787545323371887,philosophy_mmlu,4.224e-06,14.135704,21.757688,"(0,)",results_philosophy_mmlu,4.6204e-06,15.8195158,1,24.3494126,"[([0], ['mistral:7b'])]",0.5758853375911712,philosophy_mmlu,7256.34126996994,qoa_results_philosophy_mmlu_pop200_gen200_add0p3_flip0p1_mut0p3_level4_bound5_cb1p22em05_lb200_20.csv,"[{""node"": 0, ""type"": ""leaf"", ""model"": ""mistral:7b"", ""prompt"": ""Question: According to Hume, justice: A) has no value. B) has value in part because it is useful to society. C) has value solely because it is useful to society. D) has value solely because it is useful to the agent. Above are multiple-choice questions (with answers) related to philosophy. Respond with the option letter only. Example: F. Do not include any other text or explanation.\n\nSelect the correct answer.\n\nFormat: \""the answer is X)Option text.\""\nExample: \""the answer is C)Hypertension.\""\n\nOutput (nothing else):"", ""raw_output"": ""the answer is B) has value in part because it is useful to society."", ""output"": ""the answer is B) has value in part because it is useful to society."", ""input_tokens"": 120, ""output_tokens"": 16}]",0,0.0,Infeasible (Latency)
F,B,"Which of the following propositions is an immediate (one-step) consequence in PL of the given premises?
(N ⊃ ~O) ⊃ (O ∨ Q)
P ⊃ (N ⊃ ~O)
N ⊃ P A) P ⊃ O B) O ∨ Q C) N ⊃ Q D) O ∨ P E) ~N F) P G) N ⊃ ~O H) P ⊃ Q I) ~O ∨ Q J) ~P Above are multiple-choice questions (with answers) related to philosophy. Respond with the option letter only. Example: F. Do not include any other text or explanation.",0.2027934193611145,philosophy_mmlu,5.356e-06,18.916898,29.116906,"(0,)",results_philosophy_mmlu,4.6204e-06,15.8195158,1,24.3494126,"[([0], ['mistral:7b'])]",0.5758853375911712,philosophy_mmlu,7256.34126996994,qoa_results_philosophy_mmlu_pop200_gen200_add0p3_flip0p1_mut0p3_level4_bound5_cb1p22em05_lb200_20.csv,"[{""node"": 0, ""type"": ""leaf"", ""model"": ""mistral:7b"", ""prompt"": ""Question: Which of the following propositions is an immediate (one-step) consequence in PL of the given premises?\n(N \u2283 ~O) \u2283 (O \u2228 Q)\nP \u2283 (N \u2283 ~O)\nN \u2283 P A) P \u2283 O B) O \u2228 Q C) N \u2283 Q D) O \u2228 P E) ~N F) P G) N \u2283 ~O H) P \u2283 Q I) ~O \u2228 Q J) ~P Above are multiple-choice questions (with answers) related to philosophy. Respond with the option letter only. Example: F. Do not include any other text or explanation.\n\nSelect the correct answer.\n\nFormat: \""the answer is X)Option text.\""\nExample: \""the answer is C)Hypertension.\""\n\nOutput (nothing else):"", ""raw_output"": ""the answer is B) O \u2228 Q"", ""output"": ""the answer is B) O \u2228 Q."", ""input_tokens"": 172, ""output_tokens"": 10}]",0,0.0,Infeasible (Latency)
F,H,"The Dean was showing a visitor around the campus. The visitor asked, ""About how many students do you have here?"" After a moment of reflection the Dean replied, ""Oh, I'd guess about one in a hundred."" A) Appeal to Authority B) Red Herring C) Denying the Antecedent D) False Dilemma E) Slippery Slope F) Equivocation G) Straw Man H) Fallacy of Division I) Circular Reasoning J) Ad Hominem Above are multiple-choice questions (with answers) related to philosophy. Respond with the option letter only. Example: F. Do not include any other text or explanation.",1.0,philosophy_mmlu,5.246e-06,18.605081,28.636957,"(0,)",results_philosophy_mmlu,4.6204e-06,15.8195158,1,24.3494126,"[([0], ['mistral:7b'])]",0.5758853375911712,philosophy_mmlu,7256.34126996994,qoa_results_philosophy_mmlu_pop200_gen200_add0p3_flip0p1_mut0p3_level4_bound5_cb1p22em05_lb200_20.csv,"[{""node"": 0, ""type"": ""leaf"", ""model"": ""mistral:7b"", ""prompt"": ""Question: The Dean was showing a visitor around the campus. The visitor asked, \""About how many students do you have here?\"" After a moment of reflection the Dean replied, \""Oh, I'd guess about one in a hundred.\"" A) Appeal to Authority B) Red Herring C) Denying the Antecedent D) False Dilemma E) Slippery Slope F) Equivocation G) Straw Man H) Fallacy of Division I) Circular Reasoning J) Ad Hominem Above are multiple-choice questions (with answers) related to philosophy. Respond with the option letter only. Example: F. Do not include any other text or explanation.\n\nSelect the correct answer.\n\nFormat: \""the answer is X)Option text.\""\nExample: \""the answer is C)Hypertension.\""\n\nOutput (nothing else):"", ""raw_output"": ""the answer is H) Fallacy of Division"", ""output"": ""the answer is H) Fallacy of Division"", ""input_tokens"": 170, ""output_tokens"": 9}]",0,0.0,Infeasible (Latency)
E,E,Select the best translation into predicate logic. All jellybeans are sweeter than all fruit. (Fx: x is a fruit; Jx: x is a jellybean; Sxy: x is sweeter than y) A) (∀x)[Jx ⊃ (∀y)(Jy ⊃ Sxy)] B) (∀x)(∀y)[(Fx • Jy) • Sxy] C) (∀x)(∀y)[Sxy ⊃ (Jx • Fy)] D) (∀x)(∀y)[Sxy ⊃ (Fy • Jx)] E) (∀x)[Jx ⊃ (∀y)(Fy ⊃ Sxy)] F) (∀x)(∀y)[(Jx • Fy) ⊃ Sxy] G) (∀x)(∀y)[(Fx • Jy) ⊃ Sxy] H) (∀x)[Fx ⊃ (∀y)(Jy ⊃ Sxy)] I) (∀x)[Fx ⊃ (∀y)(Sxy ⊃ Jy)] J) (∀x)[Jx ⊃ (∀y)(Sxy ⊃ Fy)] Above are multiple-choice questions (with answers) related to philosophy. Respond with the option letter only. Example: F. Do not include any other text or explanation.,1.0,philosophy_mmlu,1.0312e-05,35.962894000000006,55.354118,"(0,)",results_philosophy_mmlu,4.6204e-06,15.8195158,1,24.3494126,"[([0], ['mistral:7b'])]",0.5758853375911712,philosophy_mmlu,7256.34126996994,qoa_results_philosophy_mmlu_pop200_gen200_add0p3_flip0p1_mut0p3_level4_bound5_cb1p22em05_lb200_20.csv,"[{""node"": 0, ""type"": ""leaf"", ""model"": ""mistral:7b"", ""prompt"": ""Question: Select the best translation into predicate logic. All jellybeans are sweeter than all fruit. (Fx: x is a fruit; Jx: x is a jellybean; Sxy: x is sweeter than y) A) (\u2200x)[Jx \u2283 (\u2200y)(Jy \u2283 Sxy)] B) (\u2200x)(\u2200y)[(Fx \u2022 Jy) \u2022 Sxy] C) (\u2200x)(\u2200y)[Sxy \u2283 (Jx \u2022 Fy)] D) (\u2200x)(\u2200y)[Sxy \u2283 (Fy \u2022 Jx)] E) (\u2200x)[Jx \u2283 (\u2200y)(Fy \u2283 Sxy)] F) (\u2200x)(\u2200y)[(Jx \u2022 Fy) \u2283 Sxy] G) (\u2200x)(\u2200y)[(Fx \u2022 Jy) \u2283 Sxy] H) (\u2200x)[Fx \u2283 (\u2200y)(Jy \u2283 Sxy)] I) (\u2200x)[Fx \u2283 (\u2200y)(Sxy \u2283 Jy)] J) (\u2200x)[Jx \u2283 (\u2200y)(Sxy \u2283 Fy)] Above are multiple-choice questions (with answers) related to philosophy. Respond with the option letter only. Example: F. Do not include any other text or explanation.\n\nSelect the correct answer.\n\nFormat: \""the answer is X)Option text.\""\nExample: \""the answer is C)Hypertension.\""\n\nOutput (nothing else):"", ""raw_output"": ""the answer is E) (\u2200x)[Jx \u2283 (\u2200y)(Fy \u2283 Sxy)]"", ""output"": ""the answer is E) (\u2200x)[Jx \u2283 (\u2200y)(Fy \u2283 Sxy)]."", ""input_tokens"": 322, ""output_tokens"": 24}]",0,1.0,Infeasible (Latency)
D,H,What assumption does Pence think people who object to SCNT make when they say that SCNT is not best for the child? A) The parents are prioritizing their own needs over the child's. B) We can't tell what the motives of the parents are. C) The parents have ulterior motives. D) The parents have good motives. E) The parents are incapable of making decisions for the child. F) none of the above G) The parents are indifferent to the child's wellbeing. H) The parents are making an uninformed decision. I) The parents are exploiting the child for personal gain. J) The parents have bad motives. Above are multiple-choice questions (with answers) related to philosophy. Respond with the option letter only. Example: F. Do not include any other text or explanation.,0.1587709337472915,philosophy_mmlu,6.412e-06,22.450824,34.55632799999999,"(0,)",results_philosophy_mmlu,4.6204e-06,15.8195158,1,24.3494126,"[([0], ['mistral:7b'])]",0.5758853375911712,philosophy_mmlu,7256.34126996994,qoa_results_philosophy_mmlu_pop200_gen200_add0p3_flip0p1_mut0p3_level4_bound5_cb1p22em05_lb200_20.csv,"[{""node"": 0, ""type"": ""leaf"", ""model"": ""mistral:7b"", ""prompt"": ""Question: What assumption does Pence think people who object to SCNT make when they say that SCNT is not best for the child? A) The parents are prioritizing their own needs over the child's. B) We can't tell what the motives of the parents are. C) The parents have ulterior motives. D) The parents have good motives. E) The parents are incapable of making decisions for the child. F) none of the above G) The parents are indifferent to the child's wellbeing. H) The parents are making an uninformed decision. I) The parents are exploiting the child for personal gain. J) The parents have bad motives. Above are multiple-choice questions (with answers) related to philosophy. Respond with the option letter only. Example: F. Do not include any other text or explanation.\n\nSelect the correct answer.\n\nFormat: \""the answer is X)Option text.\""\nExample: \""the answer is C)Hypertension.\""\n\nOutput (nothing else):"", ""raw_output"": ""the answer is H) The parents are making an uninformed decision."", ""output"": ""the answer is H) The parents are making an uninformed decision."", ""input_tokens"": 202, ""output_tokens"": 14}]",0,0.0,Infeasible (Latency)
A,E,"Use the following key to translate the given formula of PL to natural, English sentences.
A: Marina reads a Percy Jackson book.
B: Izzy plays Minecraft.
C: Emily stops working.
D: Russell makes dinner.
E: Ashleigh stops by.
~C ∨ D A) Emily doesn't stop working unless Russell makes dinner. B) If Emily doesn't stop working then Russell makes dinner. C) Emily stops working if Russell doesn't make dinner. D) Russell doesn't make dinner if Emily stops working. E) If Emily stops working then Russell doesn't make dinner. F) If Russell makes dinner then Emily doesn't stop working. G) Russell doesn't make dinner unless Emily stops working. H) Emily stops working unless Russell doesn't make dinner. I) Russell makes dinner if Emily doesn't stop working. Above are multiple-choice questions (with answers) related to philosophy. Respond with the option letter only. Example: F. Do not include any other text or explanation.",0.2977659106254577,philosophy_mmlu,7.499999999999999e-06,26.296567,40.475699,"(0,)",results_philosophy_mmlu,4.6204e-06,15.8195158,1,24.3494126,"[([0], ['mistral:7b'])]",0.5758853375911712,philosophy_mmlu,7256.34126996994,qoa_results_philosophy_mmlu_pop200_gen200_add0p3_flip0p1_mut0p3_level4_bound5_cb1p22em05_lb200_20.csv,"[{""node"": 0, ""type"": ""leaf"", ""model"": ""mistral:7b"", ""prompt"": ""Question: Use the following key to translate the given formula of PL to natural, English sentences.\nA: Marina reads a Percy Jackson book.\nB: Izzy plays Minecraft.\nC: Emily stops working.\nD: Russell makes dinner.\nE: Ashleigh stops by.\n~C \u2228 D A) Emily doesn't stop working unless Russell makes dinner. B) If Emily doesn't stop working then Russell makes dinner. C) Emily stops working if Russell doesn't make dinner. D) Russell doesn't make dinner if Emily stops working. E) If Emily stops working then Russell doesn't make dinner. F) If Russell makes dinner then Emily doesn't stop working. G) Russell doesn't make dinner unless Emily stops working. H) Emily stops working unless Russell doesn't make dinner. I) Russell makes dinner if Emily doesn't stop working. Above are multiple-choice questions (with answers) related to philosophy. Respond with the option letter only. Example: F. Do not include any other text or explanation.\n\nSelect the correct answer.\n\nFormat: \""the answer is X)Option text.\""\nExample: \""the answer is C)Hypertension.\""\n\nOutput (nothing else):"", ""raw_output"": ""E) If Emily stops working then Russell doesn't make dinner."", ""output"": ""the answer is E) If Emily stops working then Russell doesn't make dinner."", ""input_tokens"": 237, ""output_tokens"": 16}]",0,0.0,Infeasible (Latency)
F,D,"Which of the given formulas of PL is the best symbolization of the following sentence?
A person is considered to have lived with you for all of the present year if the person was born or died in the present year and your home was this person's home for the entire time this person was alive. A) H ⊃ [(B ∨ D) • L] B) (L ∨ B) • (D ⊃ H) C) [L ⊃ (B ∨ D)] • H D) (B ∨ D) ⊃ (H • L) E) L ⊃ (B ∨ D • H) F) [(B ∨ D) • H] ⊃ L G) L ⊃ [(B ∨ D) • H] H) L ⊃ [(H • B) ∨ D] I) [(B ∨ D) ∨ H] ⊃ L J) (B ∨ D • H) ⊃ L Above are multiple-choice questions (with answers) related to philosophy. Respond with the option letter only. Example: F. Do not include any other text or explanation.",0.3496561646461487,philosophy_mmlu,7.991999999999999e-06,28.895042,44.475274,"(0,)",results_philosophy_mmlu,4.6204e-06,15.8195158,1,24.3494126,"[([0], ['mistral:7b'])]",0.5758853375911712,philosophy_mmlu,7256.34126996994,qoa_results_philosophy_mmlu_pop200_gen200_add0p3_flip0p1_mut0p3_level4_bound5_cb1p22em05_lb200_20.csv,"[{""node"": 0, ""type"": ""leaf"", ""model"": ""mistral:7b"", ""prompt"": ""Question: Which of the given formulas of PL is the best symbolization of the following sentence?\nA person is considered to have lived with you for all of the present year if the person was born or died in the present year and your home was this person's home for the entire time this person was alive. A) H \u2283 [(B \u2228 D) \u2022 L] B) (L \u2228 B) \u2022 (D \u2283 H) C) [L \u2283 (B \u2228 D)] \u2022 H D) (B \u2228 D) \u2283 (H \u2022 L) E) L \u2283 (B \u2228 D \u2022 H) F) [(B \u2228 D) \u2022 H] \u2283 L G) L \u2283 [(B \u2228 D) \u2022 H] H) L \u2283 [(H \u2022 B) \u2228 D] I) [(B \u2228 D) \u2228 H] \u2283 L J) (B \u2228 D \u2022 H) \u2283 L Above are multiple-choice questions (with answers) related to philosophy. Respond with the option letter only. Example: F. Do not include any other text or explanation.\n\nSelect the correct answer.\n\nFormat: \""the answer is X)Option text.\""\nExample: \""the answer is C)Hypertension.\""\n\nOutput (nothing else):"", ""raw_output"": ""G) L \u2283 [(B \u2228 D) \u2022 H]"", ""output"": ""the answer is D) \u2022 H]."", ""input_tokens"": 270, ""output_tokens"": 8}]",0,0.0,Infeasible (Latency)
J,H,Epicurus claims that all other virtues spring from: A) temperance. B) self-control. C) humility. D) faith. E) integrity. F) courage. G) honesty. H) wisdom. I) justice. J) prudence. Above are multiple-choice questions (with answers) related to philosophy. Respond with the option letter only. Example: F. Do not include any other text or explanation.,0.2002609223127365,philosophy_mmlu,3.794e-06,13.408131,20.637807,"(0,)",results_philosophy_mmlu,4.6204e-06,15.8195158,1,24.3494126,"[([0], ['mistral:7b'])]",0.5758853375911712,philosophy_mmlu,7256.34126996994,qoa_results_philosophy_mmlu_pop200_gen200_add0p3_flip0p1_mut0p3_level4_bound5_cb1p22em05_lb200_20.csv,"[{""node"": 0, ""type"": ""leaf"", ""model"": ""mistral:7b"", ""prompt"": ""Question: Epicurus claims that all other virtues spring from: A) temperance. B) self-control. C) humility. D) faith. E) integrity. F) courage. G) honesty. H) wisdom. I) justice. J) prudence. Above are multiple-choice questions (with answers) related to philosophy. Respond with the option letter only. Example: F. Do not include any other text or explanation.\n\nSelect the correct answer.\n\nFormat: \""the answer is X)Option text.\""\nExample: \""the answer is C)Hypertension.\""\n\nOutput (nothing else):"", ""raw_output"": ""the answer is H) wisdom."", ""output"": ""the answer is H) wisdom."", ""input_tokens"": 122, ""output_tokens"": 7}]",0,0.0,Infeasible (Latency)
I,G,"According to Mill, the value of a particular pleasure depends on A) its rarity or frequency. B) societal norms and values. C) the individual's personal preference. D) the amount of effort required to obtain it. E) the potential pain that might accompany it. F) its quantity alone. G) its quality alone. H) neither its quantity nor its quality. I) both its quantity and its quality. J) the duration of the pleasure. Above are multiple-choice questions (with answers) related to philosophy. Respond with the option letter only. Example: F. Do not include any other text or explanation.",0.1380214542150497,philosophy_mmlu,9.185e-06,17.62184,25.05,"(1,)",results_philosophy_mmlu,8.217000000000001e-06,15.764688,1,22.41,"[([0], ['llama3-chatqa:8b'])]",0.7309239327907562,philosophy_mmlu,7256.34126996994,qoa_results_philosophy_mmlu_pop200_gen200_add0p3_flip0p1_mut0p3_level4_bound5_cb1p22em05_lb200_20.csv,"[{""node"": 0, ""type"": ""leaf"", ""model"": ""llama3-chatqa:8b"", ""prompt"": ""Question: According to Mill, the value of a particular pleasure depends on A) its rarity or frequency. B) societal norms and values. C) the individual's personal preference. D) the amount of effort required to obtain it. E) the potential pain that might accompany it. F) its quantity alone. G) its quality alone. H) neither its quantity nor its quality. I) both its quantity and its quality. J) the duration of the pleasure. Above are multiple-choice questions (with answers) related to philosophy. Respond with the option letter only. Example: F. Do not include any other text or explanation.\n\nSelect the correct answer.\n\nFormat: \""the answer is X)Option text.\""\nExample: \""the answer is C)Hypertension.\""\n\nOutput (nothing else):"", ""raw_output"": ""The answer is G)."", ""output"": ""the answer is G)."", ""input_tokens"": 162, ""output_tokens"": 5}]",0,0.0,Infeasible (Latency)
C,C,"According to Hume, justice: A) has no value. B) has value in part because it is useful to society. C) has value solely because it is useful to society. D) has value solely because it is useful to the agent. Above are multiple-choice questions (with answers) related to philosophy. Respond with the option letter only. Example: F. Do not include any other text or explanation.",1.0,philosophy_mmlu,7.425e-06,14.2452,20.25,"(1,)",results_philosophy_mmlu,8.217000000000001e-06,15.764688,1,22.41,"[([0], ['llama3-chatqa:8b'])]",0.7309239327907562,philosophy_mmlu,7256.34126996994,qoa_results_philosophy_mmlu_pop200_gen200_add0p3_flip0p1_mut0p3_level4_bound5_cb1p22em05_lb200_20.csv,"[{""node"": 0, ""type"": ""leaf"", ""model"": ""llama3-chatqa:8b"", ""prompt"": ""Question: According to Hume, justice: A) has no value. B) has value in part because it is useful to society. C) has value solely because it is useful to society. D) has value solely because it is useful to the agent. Above are multiple-choice questions (with answers) related to philosophy. Respond with the option letter only. Example: F. Do not include any other text or explanation.\n\nSelect the correct answer.\n\nFormat: \""the answer is X)Option text.\""\nExample: \""the answer is C)Hypertension.\""\n\nOutput (nothing else):"", ""raw_output"": ""the answer is C) has value solely because it is useful to society."", ""output"": ""the answer is C) has value solely because it is useful to society."", ""input_tokens"": 120, ""output_tokens"": 15}]",0,1.0,Infeasible (Latency)
F,"1

2","Which of the following propositions is an immediate (one-step) consequence in PL of the given premises?
(N ⊃ ~O) ⊃ (O ∨ Q)
P ⊃ (N ⊃ ~O)
N ⊃ P A) P ⊃ O B) O ∨ Q C) N ⊃ Q D) O ∨ P E) ~N F) P G) N ⊃ ~O H) P ⊃ Q I) ~O ∨ Q J) ~P Above are multiple-choice questions (with answers) related to philosophy. Respond with the option letter only. Example: F. Do not include any other text or explanation.",0.2943695783615112,philosophy_mmlu,9.625e-06,18.466,26.25,"(1,)",results_philosophy_mmlu,8.217000000000001e-06,15.764688,1,22.41,"[([0], ['llama3-chatqa:8b'])]",0.7309239327907562,philosophy_mmlu,7256.34126996994,qoa_results_philosophy_mmlu_pop200_gen200_add0p3_flip0p1_mut0p3_level4_bound5_cb1p22em05_lb200_20.csv,"[{""node"": 0, ""type"": ""leaf"", ""model"": ""llama3-chatqa:8b"", ""prompt"": ""Question: Which of the following propositions is an immediate (one-step) consequence in PL of the given premises?\n(N \u2283 ~O) \u2283 (O \u2228 Q)\nP \u2283 (N \u2283 ~O)\nN \u2283 P A) P \u2283 O B) O \u2228 Q C) N \u2283 Q D) O \u2228 P E) ~N F) P G) N \u2283 ~O H) P \u2283 Q I) ~O \u2228 Q J) ~P Above are multiple-choice questions (with answers) related to philosophy. Respond with the option letter only. Example: F. Do not include any other text or explanation.\n\nSelect the correct answer.\n\nFormat: \""the answer is X)Option text.\""\nExample: \""the answer is C)Hypertension.\""\n\nOutput (nothing else):"", ""raw_output"": ""1\n\n2"", ""output"": ""1\n\n2"", ""input_tokens"": 172, ""output_tokens"": 3}]",0,0.0,Infeasible (Latency)
F,G,"The Dean was showing a visitor around the campus. The visitor asked, ""About how many students do you have here?"" After a moment of reflection the Dean replied, ""Oh, I'd guess about one in a hundred."" A) Appeal to Authority B) Red Herring C) Denying the Antecedent D) False Dilemma E) Slippery Slope F) Equivocation G) Straw Man H) Fallacy of Division I) Circular Reasoning J) Ad Hominem Above are multiple-choice questions (with answers) related to philosophy. Respond with the option letter only. Example: F. Do not include any other text or explanation.",0.3070025146007538,philosophy_mmlu,9.79e-06,18.78256,26.7,"(1,)",results_philosophy_mmlu,8.217000000000001e-06,15.764688,1,22.41,"[([0], ['llama3-chatqa:8b'])]",0.7309239327907562,philosophy_mmlu,7256.34126996994,qoa_results_philosophy_mmlu_pop200_gen200_add0p3_flip0p1_mut0p3_level4_bound5_cb1p22em05_lb200_20.csv,"[{""node"": 0, ""type"": ""leaf"", ""model"": ""llama3-chatqa:8b"", ""prompt"": ""Question: The Dean was showing a visitor around the campus. The visitor asked, \""About how many students do you have here?\"" After a moment of reflection the Dean replied, \""Oh, I'd guess about one in a hundred.\"" A) Appeal to Authority B) Red Herring C) Denying the Antecedent D) False Dilemma E) Slippery Slope F) Equivocation G) Straw Man H) Fallacy of Division I) Circular Reasoning J) Ad Hominem Above are multiple-choice questions (with answers) related to philosophy. Respond with the option letter only. Example: F. Do not include any other text or explanation.\n\nSelect the correct answer.\n\nFormat: \""the answer is X)Option text.\""\nExample: \""the answer is C)Hypertension.\""\n\nOutput (nothing else):"", ""raw_output"": ""The answer is G)Equivocation"", ""output"": ""the answer is G)Equivocation"", ""input_tokens"": 170, ""output_tokens"": 8}]",0,0.0,Infeasible (Latency)
D,J,What assumption does Pence think people who object to SCNT make when they say that SCNT is not best for the child? A) The parents are prioritizing their own needs over the child's. B) We can't tell what the motives of the parents are. C) The parents have ulterior motives. D) The parents have good motives. E) The parents are incapable of making decisions for the child. F) none of the above G) The parents are indifferent to the child's wellbeing. H) The parents are making an uninformed decision. I) The parents are exploiting the child for personal gain. J) The parents have bad motives. Above are multiple-choice questions (with answers) related to philosophy. Respond with the option letter only. Example: F. Do not include any other text or explanation.,0.1637368500232696,philosophy_mmlu,1.166e-05,22.37024,31.8,"(1,)",results_philosophy_mmlu,8.217000000000001e-06,15.764688,1,22.41,"[([0], ['llama3-chatqa:8b'])]",0.7309239327907562,philosophy_mmlu,7256.34126996994,qoa_results_philosophy_mmlu_pop200_gen200_add0p3_flip0p1_mut0p3_level4_bound5_cb1p22em05_lb200_20.csv,"[{""node"": 0, ""type"": ""leaf"", ""model"": ""llama3-chatqa:8b"", ""prompt"": ""Question: What assumption does Pence think people who object to SCNT make when they say that SCNT is not best for the child? A) The parents are prioritizing their own needs over the child's. B) We can't tell what the motives of the parents are. C) The parents have ulterior motives. D) The parents have good motives. E) The parents are incapable of making decisions for the child. F) none of the above G) The parents are indifferent to the child's wellbeing. H) The parents are making an uninformed decision. I) The parents are exploiting the child for personal gain. J) The parents have bad motives. Above are multiple-choice questions (with answers) related to philosophy. Respond with the option letter only. Example: F. Do not include any other text or explanation.\n\nSelect the correct answer.\n\nFormat: \""the answer is X)Option text.\""\nExample: \""the answer is C)Hypertension.\""\n\nOutput (nothing else):"", ""raw_output"": ""the answer is J)The parents have bad motives"", ""output"": ""the answer is J)The parents have bad motives"", ""input_tokens"": 202, ""output_tokens"": 10}]",0,0.0,Infeasible (Latency)
