Annotated Answer,Final_Output,Original_Query,Quality_of_Answer,Query Type,Total_Cost,Total_Energy,Total_Latency,assignment,category,cost,energy,iteration,latency,plan,qoa,query_type,run_time_seconds,source_file,step_logs,struct_id,New_QoA_Score,Feasibility
I,A,"This question refers to the following information.
Albeit the king's Majesty justly and rightfully is and ought to be the supreme head of the Church of England, and so is recognized by the clergy of this realm in their convocations, yet nevertheless, for corroboration and confirmation thereof, and for increase of virtue in Christ's religion within this realm of England, and to repress and extirpate all errors, heresies, and other enormities and abuses heretofore used in the same, be it enacted, by authority of this present Parliament, that the king, our sovereign lord, his heirs and successors, kings of this realm, shall be taken, accepted, and reputed the only supreme head in earth of the Church of England, called Anglicans Ecclesia; and shall have and enjoy, annexed and united to the imperial crown of this realm, as well the title and style thereof, as all honors, dignities, preeminences, jurisdictions, privileges, authorities, immunities, profits, and commodities to the said dignity of the supreme head of the same Church belonging and appertaining; and that our said sovereign lord, his heirs and successors, kings of this realm, shall have full power and authority from time to time to visit, repress, redress, record, order, correct, restrain, and amend all such errors, heresies, abuses, offenses, contempts, and enormities, whatsoever they be, which by any manner of spiritual authority or jurisdiction ought or may lawfully be reformed, repressed, ordered, redressed, corrected, restrained, or amended, most to the pleasure of Almighty God, the increase of virtue in Christ's religion, and for the conservation of the peace, unity, and tranquility of this realm; any usage, foreign land, foreign authority, prescription, or any other thing or things to the contrary hereof notwithstanding.
English Parliament, Act of Supremacy, 1534
From the passage and its historical context, one may infer that the Act was, in part, A) a move to consolidate all religious power under the monarchy B) a measure to strengthen England's ties with the Catholic Church C) a response to the threat of invasion by Spain D) an attempt to legitimize Henry VIII's only heir E) a move to prevent religious conflict within England F) an attempt to ally England with the Holy Roman Emperor G) an attempt to discredit the Pope's authority in England H) an attempt to prevent the spread of Protestantism in England I) a solution to Henry VIII's financial difficulties J) an attempt to establish a state religion in England Above are multiple-choice questions (with answers) related to history. Respond with the option letter only. Example: F. Do not include any other text or explanation.",0.0610945597290992,history_mmlu,1.7804e-05,64.546119,99.34944299999998,"(0,)",results_history_mmlu,6.919799999999999e-06,24.3840894,1,37.5320118,"[([0], ['mistral:7b'])]",0.7511158943176269,history_mmlu,15092.09758758545,qoa_results_history_mmlu_pop200_gen200_add0p3_flip0p1_mut0p3_level4_bound5_cb1p22em05_lb200_20.csv,"[{""node"": 0, ""type"": ""leaf"", ""model"": ""mistral:7b"", ""prompt"": ""Question: This question refers to the following information.\nAlbeit the king's Majesty justly and rightfully is and ought to be the supreme head of the Church of England, and so is recognized by the clergy of this realm in their convocations, yet nevertheless, for corroboration and confirmation thereof, and for increase of virtue in Christ's religion within this realm of England, and to repress and extirpate all errors, heresies, and other enormities and abuses heretofore used in the same, be it enacted, by authority of this present Parliament, that the king, our sovereign lord, his heirs and successors, kings of this realm, shall be taken, accepted, and reputed the only supreme head in earth of the Church of England, called Anglicans Ecclesia; and shall have and enjoy, annexed and united to the imperial crown of this realm, as well the title and style thereof, as all honors, dignities, preeminences, jurisdictions, privileges, authorities, immunities, profits, and commodities to the said dignity of the supreme head of the same Church belonging and appertaining; and that our said sovereign lord, his heirs and successors, kings of this realm, shall have full power and authority from time to time to visit, repress, redress, record, order, correct, restrain, and amend all such errors, heresies, abuses, offenses, contempts, and enormities, whatsoever they be, which by any manner of spiritual authority or jurisdiction ought or may lawfully be reformed, repressed, ordered, redressed, corrected, restrained, or amended, most to the pleasure of Almighty God, the increase of virtue in Christ's religion, and for the conservation of the peace, unity, and tranquility of this realm; any usage, foreign land, foreign authority, prescription, or any other thing or things to the contrary hereof notwithstanding.\nEnglish Parliament, Act of Supremacy, 1534\nFrom the passage and its historical context, one may infer that the Act was, in part, A) a move to consolidate all religious power under the monarchy B) a measure to strengthen England's ties with the Catholic Church C) a response to the threat of invasion by Spain D) an attempt to legitimize Henry VIII's only heir E) a move to prevent religious conflict within England F) an attempt to ally England with the Holy Roman Emperor G) an attempt to discredit the Pope's authority in England H) an attempt to prevent the spread of Protestantism in England I) a solution to Henry VIII's financial difficulties J) an attempt to establish a state religion in England Above are multiple-choice questions (with answers) related to history. Respond with the option letter only. Example: F. Do not include any other text or explanation.\n\nSelect the correct answer.\n\nFormat: \""the answer is X)Option text.\""\nExample: \""the answer is C)Hypertension.\""\n\nOutput (nothing else):"", ""raw_output"": ""The answer is A) a move to consolidate all religious power under the monarchy."", ""output"": ""the answer is A) a move to consolidate all religious power under the monarchy."", ""input_tokens"": 605, ""output_tokens"": 16}]",0,0.0,Infeasible (Both)
I,E,"This question refers to the following information.
The following quote is from Voltaire in response to the 1755 Lisbon earthquake.
My dear sir, nature is very cruel. One would find it hard to imagine how the laws of movement cause such frightful disasters in the best of possible worlds. A hundred thousand ants, our fellows, crushed all at once in our ant-hill, and half of them perishing, no doubt in unspeakable agony, beneath the wreckage from which they cannot be drawn. Families ruined all over Europe, the fortune of a hundred businessmen, your compatriots, swallowed up in the ruins of Lisbon. What a wretched gamble is the game of human life! What will the preachers say, especially if the palace of the Inquisition is still standing? I flatter myself that at least the reverend father inquisitors have been crushed like others. That ought to teach men not to persecute each other, for while a few holy scoundrels burn a few fanatics, the earth swallows up one and all.
—Voltaire, in a letter, 1755
The ideas expressed by Voltaire, above, best illustrate which of the following characteristics of Enlightenment intellectuals? A) Many believed in the necessity of preserving the traditional religious doctrines. B) Most rejected religion altogether and adopted atheism as the only credo of a rational man. C) They were largely disconnected from the realities of the common people. D) They endorsed the absolute power of the monarchies and aristocracies. E) They believed that human suffering and disasters are inevitable and justified. F) They rejected the idea of scientific discoveries having any impact on social and cultural issues. G) Most actively advocated for the abolition of all forms of governance. H) They utilized new methods of communicating their ideas, such as salons and inexpensive printed pamphlets. I) Many believed that the new scientific discoveries justified a more tolerant and objective approach to social and cultural issues. J) Many were accomplished scientists, who added important pieces to human understanding of the universe. Above are multiple-choice questions (with answers) related to history. Respond with the option letter only. Example: F. Do not include any other text or explanation.",0.0465654619038105,history_mmlu,1.4498e-05,52.177378,80.311466,"(0,)",results_history_mmlu,6.919799999999999e-06,24.3840894,1,37.5320118,"[([0], ['mistral:7b'])]",0.7511158943176269,history_mmlu,15092.09758758545,qoa_results_history_mmlu_pop200_gen200_add0p3_flip0p1_mut0p3_level4_bound5_cb1p22em05_lb200_20.csv,"[{""node"": 0, ""type"": ""leaf"", ""model"": ""mistral:7b"", ""prompt"": ""Question: This question refers to the following information.\nThe following quote is from Voltaire in response to the 1755 Lisbon earthquake.\nMy dear sir, nature is very cruel. One would find it hard to imagine how the laws of movement cause such frightful disasters in the best of possible worlds. A hundred thousand ants, our fellows, crushed all at once in our ant-hill, and half of them perishing, no doubt in unspeakable agony, beneath the wreckage from which they cannot be drawn. Families ruined all over Europe, the fortune of a hundred businessmen, your compatriots, swallowed up in the ruins of Lisbon. What a wretched gamble is the game of human life! What will the preachers say, especially if the palace of the Inquisition is still standing? I flatter myself that at least the reverend father inquisitors have been crushed like others. That ought to teach men not to persecute each other, for while a few holy scoundrels burn a few fanatics, the earth swallows up one and all.\n\u2014Voltaire, in a letter, 1755\nThe ideas expressed by Voltaire, above, best illustrate which of the following characteristics of Enlightenment intellectuals? A) Many believed in the necessity of preserving the traditional religious doctrines. B) Most rejected religion altogether and adopted atheism as the only credo of a rational man. C) They were largely disconnected from the realities of the common people. D) They endorsed the absolute power of the monarchies and aristocracies. E) They believed that human suffering and disasters are inevitable and justified. F) They rejected the idea of scientific discoveries having any impact on social and cultural issues. G) Most actively advocated for the abolition of all forms of governance. H) They utilized new methods of communicating their ideas, such as salons and inexpensive printed pamphlets. I) Many believed that the new scientific discoveries justified a more tolerant and objective approach to social and cultural issues. J) Many were accomplished scientists, who added important pieces to human understanding of the universe. Above are multiple-choice questions (with answers) related to history. Respond with the option letter only. Example: F. Do not include any other text or explanation.\n\nSelect the correct answer.\n\nFormat: \""the answer is X)Option text.\""\nExample: \""the answer is C)Hypertension.\""\n\nOutput (nothing else):"", ""raw_output"": ""E) They believed that human suffering and disasters are inevitable and justified."", ""output"": ""the answer is E) They believed that human suffering and disasters are inevitable and justified."", ""input_tokens"": 485, ""output_tokens"": 17}]",0,0.0,Infeasible (Both)
G,H,"This question refers to the following information.
""When the gods fashioned Gilgamesh*, to him they gave a perfect form. The glorious sun Shamash bestowed upon him glory; Adad the terrible god of storms bestowed upon him courage. The great gods perfected his magnificence beyond all others, terrible like the great wild bull. Two thirds god they made him; one third man they made him.
Of Uruk, its great rampart he built, and the wall of the sacred Eanna temple, the holy sanctuary. Behold the outer walls which gleam with the brilliance of copper; see the inner wall which none might rival. Touch the threshold stone—it is from ancient days. Goest thou into the Eanna temple, yea, the dwelling place of Ishtar, the like of which no subsequent king or living man might equal. Ascend and walk about on the wall of Uruk, inspect the corner-stone, and examine its brick-work, whether its wall is not made of burned brick, and its foundation laid by the Seven Sages. One third for city, one third for garden, one third for field, and a precinct for the temple of Ishtar. These parts and the precinct comprise Uruk.""
The Epic of Gilgamesh, ca. 2100 B.C.E.
*Gilgamesh was a king of Uruk.
Which of the following best describes the origins of epic poetry such as the Epic of Gilgamesh? A) The rise of a merchant class in cities who could sponsor the creation of original art B) The rise of a priestly class who were believed to have the power to communicate with the gods C) The rise of a religious caste dedicated to solely recording the deeds of God-Kings D) The rise of a democratic society in which the people chose what stories were worthy of recording E) The rise of a class of explorers who documented their journeys and adventures in the form of epic poetry F) The rise of a noble class who commissioned poems to immortalize their family histories G) The rise of a literate class of scribes in cities who could record poems H) The rise of an agricultural society that had the resources to support a class of poets I) The rise of a warrior elite whose deeds were worthy of praise and recording J) The rise of a scholarly class who translated oral stories into written form Above are multiple-choice questions (with answers) related to history. Respond with the option letter only. Example: F. Do not include any other text or explanation.",0.1024275720119476,history_mmlu,1.6448e-05,58.933413,90.710361,"(0,)",results_history_mmlu,6.919799999999999e-06,24.3840894,1,37.5320118,"[([0], ['mistral:7b'])]",0.7511158943176269,history_mmlu,15092.09758758545,qoa_results_history_mmlu_pop200_gen200_add0p3_flip0p1_mut0p3_level4_bound5_cb1p22em05_lb200_20.csv,"[{""node"": 0, ""type"": ""leaf"", ""model"": ""mistral:7b"", ""prompt"": ""Question: This question refers to the following information.\n\""When the gods fashioned Gilgamesh*, to him they gave a perfect form. The glorious sun Shamash bestowed upon him glory; Adad the terrible god of storms bestowed upon him courage. The great gods perfected his magnificence beyond all others, terrible like the great wild bull. Two thirds god they made him; one third man they made him.\nOf Uruk, its great rampart he built, and the wall of the sacred Eanna temple, the holy sanctuary. Behold the outer walls which gleam with the brilliance of copper; see the inner wall which none might rival. Touch the threshold stone\u2014it is from ancient days. Goest thou into the Eanna temple, yea, the dwelling place of Ishtar, the like of which no subsequent king or living man might equal. Ascend and walk about on the wall of Uruk, inspect the corner-stone, and examine its brick-work, whether its wall is not made of burned brick, and its foundation laid by the Seven Sages. One third for city, one third for garden, one third for field, and a precinct for the temple of Ishtar. These parts and the precinct comprise Uruk.\""\nThe Epic of Gilgamesh, ca. 2100 B.C.E.\n*Gilgamesh was a king of Uruk.\nWhich of the following best describes the origins of epic poetry such as the Epic of Gilgamesh? A) The rise of a merchant class in cities who could sponsor the creation of original art B) The rise of a priestly class who were believed to have the power to communicate with the gods C) The rise of a religious caste dedicated to solely recording the deeds of God-Kings D) The rise of a democratic society in which the people chose what stories were worthy of recording E) The rise of a class of explorers who documented their journeys and adventures in the form of epic poetry F) The rise of a noble class who commissioned poems to immortalize their family histories G) The rise of a literate class of scribes in cities who could record poems H) The rise of an agricultural society that had the resources to support a class of poets I) The rise of a warrior elite whose deeds were worthy of praise and recording J) The rise of a scholarly class who translated oral stories into written form Above are multiple-choice questions (with answers) related to history. Respond with the option letter only. Example: F. Do not include any other text or explanation.\n\nSelect the correct answer.\n\nFormat: \""the answer is X)Option text.\""\nExample: \""the answer is C)Hypertension.\""\n\nOutput (nothing else):"", ""raw_output"": ""the answer is H) The rise of a literate class of scribes in cities who could record poems."", ""output"": ""the answer is H) The rise of a literate class of scribes in cities who could record poems."", ""input_tokens"": 545, ""output_tokens"": 22}]",0,0.0,Infeasible (Both)
I,A,"This question refers to the following information.
I walk alongside the column, ask what's going on.
A soldier says simply: ""They call up more every day.
""Some of us were sent north to the Yellow River at age fifteen,
And now at forty we're heading off to the garrisons in the west.
On our first tour, the village headman had to tie our bandannas for us.
When we came back, our hair was white, but still there's more unrest.
The frontier garrisons run with blood, enough to fill an ocean,
But the Martial Emperor's territorial ambitions have yet to crest.
In the hundred districts east of the mountains, throughout the land of Han,
There must be ten thousand villages that brambles now infest.
Even if wives are strong enough to handle a hoe and plow,
The crops grow every which way, the fields are all a mess.
It's hardest for the Shanxi men, with their reputations as fighters:
They're rounded up like dogs or chickens, every male impressed.
""But sir, though it's good of you to ask,
Complaining isn't part of the soldier's task.
We can only shake our heads. Take this winter:
The Shanxi troops were never sent home.
The District Officers are demanding the land tax,
But where will it come from? You can't get blood from a stone!
I honestly think it's bad luck to bear a son now,
It's better to have a daughter: at least she can marry
And live with the neighbors next door.
But a son will end up lying on some distant prairie.""
Du Fu, ""Ballad of the Army Carts,"" ca. 750 C.E.
Based on the poem and your knowledge of history, Tang relations with western nomadic peoples and frontier peoples relied on which of the following? A) The establishment of a network of spies and informants among the nomadic tribes B) Adroit diplomacy and establishment of client relationships with bordering nomads C) The payment of tribute to nomadic rulers D) The forced relocation of frontier peoples to central China E) The use of economic incentives to secure the loyalty of nomadic rulers F) The negotiation of peace treaties with nomadic rulers G) The dissemination of Chinese culture and traditions among frontier peoples H) The permanent settlement of Han Chinese in frontier zones I) The ability of the Tang emperor to project military power on the frontier in order to impose his will Above are multiple-choice questions (with answers) related to history. Respond with the option letter only. Example: F. Do not include any other text or explanation.",0.0530249178409576,history_mmlu,1.7038e-05,61.220071,94.229987,"(0,)",results_history_mmlu,6.919799999999999e-06,24.3840894,1,37.5320118,"[([0], ['mistral:7b'])]",0.7511158943176269,history_mmlu,15092.09758758545,qoa_results_history_mmlu_pop200_gen200_add0p3_flip0p1_mut0p3_level4_bound5_cb1p22em05_lb200_20.csv,"[{""node"": 0, ""type"": ""leaf"", ""model"": ""mistral:7b"", ""prompt"": ""Question: This question refers to the following information.\nI walk alongside the column, ask what's going on.\nA soldier says simply: \""They call up more every day.\n\""Some of us were sent north to the Yellow River at age fifteen,\nAnd now at forty we're heading off to the garrisons in the west.\nOn our first tour, the village headman had to tie our bandannas for us.\nWhen we came back, our hair was white, but still there's more unrest.\nThe frontier garrisons run with blood, enough to fill an ocean,\nBut the Martial Emperor's territorial ambitions have yet to crest.\nIn the hundred districts east of the mountains, throughout the land of Han,\nThere must be ten thousand villages that brambles now infest.\nEven if wives are strong enough to handle a hoe and plow,\nThe crops grow every which way, the fields are all a mess.\nIt's hardest for the Shanxi men, with their reputations as fighters:\nThey're rounded up like dogs or chickens, every male impressed.\n\""But sir, though it's good of you to ask,\nComplaining isn't part of the soldier's task.\nWe can only shake our heads. Take this winter:\nThe Shanxi troops were never sent home.\nThe District Officers are demanding the land tax,\nBut where will it come from? You can't get blood from a stone!\nI honestly think it's bad luck to bear a son now,\nIt's better to have a daughter: at least she can marry\nAnd live with the neighbors next door.\nBut a son will end up lying on some distant prairie.\""\nDu Fu, \""Ballad of the Army Carts,\"" ca. 750 C.E.\nBased on the poem and your knowledge of history, Tang relations with western nomadic peoples and frontier peoples relied on which of the following? A) The establishment of a network of spies and informants among the nomadic tribes B) Adroit diplomacy and establishment of client relationships with bordering nomads C) The payment of tribute to nomadic rulers D) The forced relocation of frontier peoples to central China E) The use of economic incentives to secure the loyalty of nomadic rulers F) The negotiation of peace treaties with nomadic rulers G) The dissemination of Chinese culture and traditions among frontier peoples H) The permanent settlement of Han Chinese in frontier zones I) The ability of the Tang emperor to project military power on the frontier in order to impose his will Above are multiple-choice questions (with answers) related to history. Respond with the option letter only. Example: F. Do not include any other text or explanation.\n\nSelect the correct answer.\n\nFormat: \""the answer is X)Option text.\""\nExample: \""the answer is C)Hypertension.\""\n\nOutput (nothing else):"", ""raw_output"": ""A) The establishment of a network of spies and informants among the nomadic tribes."", ""output"": ""the answer is A) The establishment of a network of spies and informants among the nomadic tribes."", ""input_tokens"": 568, ""output_tokens"": 21}]",0,0.0,Infeasible (Both)
